[
    {
        "owner": "0xA25f22b0Ab021A9cA1513C892e6FaacC50e92907",
        "handleIO": true,
        "evaluable": {
            "interpreter": "0x8ECd48e70954Dec0f45e4551f039A0D24038c536",
            "store": "0x13cdD62F032125Fea331Cf8B79eADE8830CD5dab",
            "expression": "0xF77F4C334F3De948BaEdf814Af7f82365171e559"
        },
        "validInputs": [{
            "token": "0xc2132D05D31c914a87C6611C10748AEb04B58e8F",
            "decimals": 6,
            "vaultId": "0x84e4bec2eccb5e3f00d2db11f82a85c0329fa210edb34fbc266e8d2e9d10ee28"
        }],
        "validOutputs": [{
            "token": "0x84342e932797FC62814189f01F0Fb05F52519708",
            "decimals": 18,
            "vaultId": "0x84e4bec2eccb5e3f00d2db11f82a85c0329fa210edb34fbc266e8d2e9d10ee28"
        }]
    }
]